{
  "diff": "diff --git a/reconcile/mapping.py b/reconcile/mapping.py\n--- a/reconcile/mapping.py\n+++ b/reconcile/mapping.py\n@@ -18,7 +18,7 @@ def map_product_tier(legacy_code):\n     tier = LEGACY_TIERS.get(legacy_code[:2])\n-    if tier is None:\n-        return \"STANDARD\"\n+    if tier is None:\n+        raise MappingError(f\"unmapped legacy product code {legacy_code}\")\n     return tier\ndiff --git a/reconcile/rounding.py b/reconcile/rounding.py\n--- a/reconcile/rounding.py\n+++ b/reconcile/rounding.py\n@@ -9,4 +9,4 @@ def recompute_interest(balance, rate, days):\n     accrued = balance * rate * days / DAYS_IN_YEAR\n-    return round(accrued, 2)\n+    return accrued.quantize(Decimal(\"0.01\"), rounding=ROUND_HALF_EVEN)\ndiff --git a/reconcile/currencies.py b/reconcile/currencies.py\n--- a/reconcile/currencies.py\n+++ b/reconcile/currencies.py\n@@ -12,5 +12,6 @@ def normalize_currency(code):\n     code = code.strip().upper()\n+    code = LEGACY_CURRENCY_ALIASES.get(code, code)\n     if code not in ISO_4217:\n-        return code\n+        raise CurrencyError(f\"unknown currency code {code}\")\n     return code\n",
  "failure_ids": [
    "FAIL-004",
    "FAIL-005",
    "FAIL-006"
  ],
  "patch_id": "PATCH-002",
  "provenance": {
    "client": "FixtureCodexClient",
    "created_at": "2026-07-12T00:00:00Z",
    "mode": "fixture",
    "producer": "fixture",
    "run_id": "RUN-002",
    "schema_version": "2026-07-12.1",
    "source_artifact_ids": [
      "ART-001"
    ],
    "validation_status": "validated"
  },
  "run_id": "RUN-002",
  "status": "pending"
}
