{
  "diff": "diff --git a/reconcile/migration.py b/reconcile/migration.py\n--- a/reconcile/migration.py\n+++ b/reconcile/migration.py\n@@ -27,14 +27,11 @@\n \n \n def _normalize_account_id(raw: str) -> str:\n-    return str(int(raw.strip()))\n+    return raw.strip()\n \n \n def _parse_effective_date(raw: str) -> str:\n-    try:\n-        return datetime.strptime(raw.strip(), \"%Y-%m-%d\").strftime(\"%Y-%m-%d\")\n-    except ValueError:\n-        return \"1900-01-01\"\n+    return datetime.strptime(raw.strip(), \"%Y-%m-%d\").strftime(\"%Y-%m-%d\")\n \n \n def _parse_amount(raw: str) -> Decimal:\n@@ -47,7 +44,7 @@\n     if txn_code == \"CREDIT\":\n         return -amount\n     if txn_code == \"CREDIT_ADJUSTMENT\":\n-        return amount\n+        return -amount\n     raise ValueError(f\"unsupported transaction code: {txn_code}\")\n \n \n",
  "failure_ids": [
    "FAIL-001",
    "FAIL-002",
    "FAIL-003"
  ],
  "patch_id": "PATCH-001",
  "provenance": {
    "client": "FixtureCodexClient",
    "created_at": "2026-07-12T00:00:00Z",
    "mode": "fixture",
    "producer": "fixture",
    "run_id": "RUN-001",
    "schema_version": "2026-07-12.1",
    "source_artifact_ids": [
      "ART-001"
    ],
    "validation_status": "validated"
  },
  "run_id": "RUN-001",
  "status": "pending"
}
